{
  "runtime": "hermesagent",
  "version": "example-not-runtime-tested",
  "observed_at": "2026-09-02T00:00:00Z",
  "capabilities": {
    "load_skill": {"available": true, "details": "~/.hermes/skills/"},
    "search": {"available": true, "mode": "host-provided", "read_only": true},
    "read_source": {"available": true},
    "delegate": {"available": true, "parallel": true},
    "artifact_io": {"available": true, "append_only": true},
    "checkpoint": {"available": true, "durable": false},
    "audit": {"available": true}
  },
  "permissions": {"external_write_default": false}
}
